0,Foster carers are to be guaranteed a minimum allowance to help cover their costs the government has announced.  Payment levels vary from area to area with some carers getting just £50 a week for clothes food and other costs. Minister for Children Young People and Families Margaret Hodge said new plans will ensure fosterers' allowances would be as fair as possible. However local authorities which set and pay the allowances are concerned about how the extra cash will be found. About 50000 children live with foster families in the UK and carers have said they need more money to make ends meet.  Ms Hodge said: ""Foster carers must not be out of pocket when meeting the costs of caring for a looked after child - a crucial role in society. ""We need to make sure that arrangements for paying foster carers are as fair and transparent as possible. ""Our proposal for a national minimum rate shows we are serious about creating a better deal for foster carers and about encouraging more people to come forward and consider fostering as a worthwhile and rewarding opportunity."" The government is seeking to amend the Children Bill which passes through the Commons next week to establish a national minimum payment.  Fostering Network executive director Robert Tapsfield criticised the existing system. ""There is just no logic to a system which values children differently depending on where they live. ""And with a shortage of over 8000 foster carers in England it's not a sustainable situation to expect carers to fund foster care from their own pockets."" The charity recommends a weekly payment of £108.49 for looking after a baby. In a survey it discovered that rates paid by neighbouring authorities could vary by as much as £100 per week.  The Association of Directors of Social Services (ADSS) said it agreed in principle with the government's plans. Tony Hunter the organisation's president said: ""There are many devils and lots of details hidden within the Government's proposals. ""But ADSS fully supports proper remuneration for valued foster carers and looks forward to working with ministers local government and the fostering organisations themselves in order to make sure a sensible and practicable policy emerges."" ";;;
0,Prince Charles and Camilla Parker Bowles are awaiting the nation's reaction after announcing they are to be married on 8 April.  Mrs Parker Bowles will take the title HRH Duchess of Cornwall after a civil ceremony to be held at Windsor Castle. A Daily Telegraph poll of 1313 people suggests two-thirds of Britons support the couple's decision to marry. But only 40% think Mrs Parker Bowles should become Princess Consort as planned after Charles becomes king. Some 47% believe she should have no title while 7% think she should become queen.  The poll also found that the majority of Britons would prefer the monarchy to miss a generation with the Queen handing the throne to her grandson Prince William 22 on her death or abdication. On Thursday night Prince Charles 56 and Mrs Parker Bowles 57 hosted a dinner at Windsor Castle their first public appearance since announcing their engagement. Mrs Parker Bowles said the prince went down on one knee to propose and added: ""I'm just coming down to earth."" She displayed her diamond engagement ring - a Royal Family heirloom - to reporters. Charles said he and his wife-to-be were ""absolutely delighted"". Their marriage will end years of speculation on a relationship which dates back to 1970.  The Queen and Duke of Edinburgh said the news had made them ""very happy"". Princes William and Harry said they are ""very happy"" and wish the couple ""all the luck in the future"". The wedding will be a civil ceremony followed by a service of prayer and dedication in St George's Chapel at which the Archbishop of Canterbury Dr Rowan Williams will preside.  The marriage is likely to be a sensitive issue because Mrs Parker Bowles is divorced and her former husband is still alive. If he became king Charles would be the supreme governor of the Church of England and some Anglicans remain opposed to the remarriage of divorcees. ""His divorce from Diana and the disappointment the country felt over how Diana had been treated... opened up a sense of disillusionment with [Prince Charles]"" said Ros Coward who wrote the authorised biography of Diana princess of Wales. The Archbishop of Canterbury said: ""I am pleased that Prince Charles and Mrs Camilla Parker Bowles have decided to take this important step."" Tony Blair said he was ""delighted"" for the couple and offered his congratulations as did Conservative leader Michael Howard and Liberal Democrat leader Charles Kennedy. Australia's Prime Minister John Howard also offered his congratulations adding that their decision to marry was a ""sensible and a good thing"". Mrs Parker Bowles has joined the prince at numerous engagements in recent years - mostly at evening events for The Prince's Trust. Clarence House staff were at pains to point out that she attended these events in a private capacity. ";;;
0,UK Muslims should accept that people of Islamic appearance are more likely to be stopped and searched by police a Home Office minister has said.  Hazel Blears said innocent Muslims would be targeted because of the search for Islamic extremists. Qualifications for religious leaders to enter the UK could also be made tougher she told a Commons inquiry. Her comments have been described as ""irresponsible"" and ""outrageous"" by the Islamic Human Rights Commission (IHRC).  ""The threat is most likely to come from those people associated with an extreme form of Islam or who are falsely hiding behind Islam"" the Salford MP told the Commons home affairs committee.  ""It means that some of our counter-terrorism powers will be disproportionately experienced by the Muslim community."" It was a reality that should be recognised she said. ""If a threat is from a particular place then our action is going to be targeted at that area"" she added. On ministers of religions such as imams she said faith groups would be asked what other qualifications and skills such as civic knowledge and ability to engage the community should be demanded. Last year ministers introduced a requirement that ministers should speak English to a certain level.  IHRC chairman Massoud Shadjareh accused Ms Blears of ""playing an Islamophobia card"" in the run-up to a general election.  ""She is demonising and alienating our community"" he said. ""It is a legitimisation for a backlash and for racists to have an onslaught on our community. ""This sort of comment is just music to the ears of racists."" Later the prime minister's official spokesman urged people to put Ms Blears' comments into context. The minister had been saying she understood there was a perception that stop and search was aimed at one community but that was not what was happening the spokesman said.  ""What is happening is that those powers are aimed at those who are suspected of carrying out or planning certain activity who happen to come from one community. ""It is not aimed at a particular community it is not police policy to aim these powers at a particular community"" he added. Statistics showed that of the 17 people found guilty of terrorist acts in the UK since the 11 September attacks only four of the 12 whose ethnic backgrounds were known were Muslim he added Figures published last week showed that people from ethnic minorities were increasingly likely to be targeted by police stop and search tactics.  Figures showed that for 2003/2004 Asians were 1.9 times more likely to be stopped and searched compared with 1.7 times more likely in the previous year. Separate figures on police searches in England and Wales carried out under the Terrorism Act 2000 showed that ethnic minorities were more likely to be targeted. Muslim groups have repeatedly claimed that their communities are being victimised under terror laws. In 2003/2004 12.5% searches under the laws were on Asian people even though they make up 4.7% of the population. Last July the police were accused of Islamophobia by Muslim groups after stop and search figures showed the numbers of Asians targeted had risen by 300% since the introduction of anti-terror laws. ";;;
0,Michael Howard has launched an attack on the cost of Britain's ""chaotic"" asylum system under Tony Blair.  The Tory leader said English local authorities have spent more than £3bn - or £140 per household - on asylum since Labour won power in 1997. Mr Howard is expected to tell activists in Kent that voters' tolerance and desire to help others are being abused. Other parties and refugee agencies have already attacked Tory plans for annual limits on numbers.  Mr Howard said Britain should take its fair share of the world's ""genuine refugees"".  ""The anniversary of the liberation of Auschwitz - where my grandmother was murdered along with over a million others - has reminded all of us that we have a moral responsibility to those fleeing persecution"" he was due to say. ""But if we are to fulfil responsibility we have to get a grip of the system. ""Fair play matters. People want a government that upholds the rules - not one that turns a blind eye when they are bent and abused"" he said. ""And let's be clear. Our asylum system is being abused - and with it Britain's generosity."" Earlier this week Mr Howard said his party's plans to cut immigration were not racist arguing they would make the asylum system fairer for genuine refugees. If elected his party would institute an annual limit on asylum and all claims would be processed overseas.  That prompted some charities to say the plans would put refugees' lives at risk if they were turned away once quotas were filled. ""If we have a moral responsibility towards people fleeing persecution then these policies will not provide a safe haven"" said Hannah Ward of the Refugee Council. ""If people turn up in the UK asking for help they will be turned away. Michael Howard's policy effectively means there is no safe haven in the UK. ""When it comes to costs then perhaps we should start with how decisions are made on asylum seekers. So many of them are shown to be wrong - one in five decisions that are appealed are successfully overturned rising to half for some nationalities. ""We need good quality decision-making on asylum applications because it is delays in the system which cost so much.""  Tony Blair said Labour would set out workable plans for tackling immigration abuse in the next few weeks and attacked the Tory plans. ""By cutting the number of front-line immigration staff at our borders they will actually make the problem worse"" said Mr Blair. Liberal Democrat chairman Matthew Taylor said there needed to be a quick fair and firm asylum system. But he said it was ""absolutely disgusting"" to propose a system which could turn away genuine refugees. The Conservatives say there is little risk of this happening as demand for asylum will be considered when quotas are set. On Monday Mr Howard said: ""It's not racist as some people to claim to talk about controlling immigration far from it."" ";;;
0,Gordon Brown has outlined what he thinks should be the key themes of New Labour's next general election bid.  He said ensuring every child in Britain had the best start in life could be a legacy to match the NHS's creation. The chancellor has previously planned the party's election strategy but this time the role will be filled by Alan Milburn - a key ally of Tony Blair. The premier insisted Mr Brown will have a key role in Labour's campaign and praised his handling of the economy.  Writing in the Guardian newspaper Mr Brown outlined his view of the direction New Labour should be taking. ""As our manifesto and our programme for the coming decade should make clear Labour's ambition is not simply tackling idleness but delivering full employment";" not just attacking ignorance disease and squalor but promoting lifelong education good health and sustainable communities."" BBC political editor Andrew Marr said that Mr Brown's article was ""a warning shot"" to Mr Blair not to try and cut him out of the manifesto writing process. ""It was as always coded and careful... but entirely deliberate"" was Mr Marr's assessment. The prime minister was asked about Mr Brown's article and about his election role when he appeared on BBC Radio 4's Today programme. Mr Blair said a decision had yet to be taken over how the election would be run but the chancellor's role would be ""central"". Mr Blair argued that under New Labour the country had changed for the better and that was ""in part"" because of Mr Brown's management of the economy. And he pledged childcare would be a ""centrepiece"" of Labour's manifesto. He also predicted the next general election will be a ""tough tough fight"" for New Labour. But the prime minister insisted he did not know what date the poll would take place despite speculation about 5 May. Mr Blair said he was taking ""nothing for granted"" ahead of the vote - warning that the Tory strategy was to win power via the back door by hinting they were aiming to cut Labour's majority instead of hoping for an outright win. ";;
0,Two of Britain's big trade unions could merge to form a ""super union"" of two million members.  The move by Amicus and the Transport and General Workers Union (TGWU) would be a seen as a bid to carry more weight with ministers and employers. Amicus has 1.2 million members and the TGWU has 800000. Any merger would have to be approved by the unions' executives and their membership. It is understood meetings will be held on Wednesday about the proposal. Along with the GMB and Unison the TGWU and Amicus worked closely together in the last year to hammer out a 56-point deal with Labour's leadership over equality at work holidays and pensions - the Warwick Agreement. Both unions are remaining tight-lipped about the merger rumours but one insider pointed out to the BBC News website that ""nobody is denying suggestions a merger could be on the agenda"" when the two unions' executives hold their meetings on Wednesday. Amicus's executive was due to meet in any case although the TGWU is holding specially scheduled talks. ";;;
0,UK firms are embracing internet trading opportunities as never before e-commerce minister Mike O'Brien says.  A government-commissioned study ranked the UK third in its world index of use of information and communication technology (ICT). The report suggests 69% of UK firms are now using broadband and that 30% of micro businesses are trading online. Mr O'Brien said UK businesses were sprinting forward in ICT use but that there were more challenges ahead. The report carried out independently by consultants Booz Allen Hamilton and HI Europe placed the UK third behind Sweden and Ireland for business use of ICT.  It showed British business brought greater maturity to their ICT use by using broadband in increased numbers bringing ICT into their business plans and using new technologies such as voice activated programmes and desktop video conferences. Mr O'Brien said: ""The increase in the proportion of business connected by broadband shows that UK companies are embracing the opportunities that ICT can bring. ""It is particularly encouraging to see that small businesses are beginning to narrow the digital divide that appeared to have opened up in recent years."" The government would play its part in ""cultivating an environment where information and communication technologies can flourish"" Mr O'Brien said. The ""clear message"" the report sends is that effective use of ICT can bring real improvements in business performance for all business.  ""However we are not at the finishing line yet and many challenges remain if the UK is to reach its aim of becoming a world-leading e-economy"" he added. The International Benchmarking Study was based on 8000 telephone interviews with businesses of which more than 2700 were UK businesses. It is the eighth in a series of examining the adoption and deployment of ICT in the world's most industrialised nations. ";;;
0,Tony Blair has had the chance to tackle the problems facing Britain and has failed Michael Howard has said.  ""Britain is heading in the wrong direction"" the Conservative leader said in his New Year message. Mr Blair's government was a ""bossy interfering government that takes decisions that should be made by individuals"" he added. But Labour's campaign spokesman Fraser Kemp responded: ""Britain is working don't let the Tories wreck it again"". Mr Howard also paid tribute to the nation's character for its generous response to the Asian quake disaster. The catastrophe was overshadowing the hopes for the future at this usually positive time of the year Mr Howard said.  ""We watched the scenes of destruction with a sense of disbelief. The scale the speed the ferocity of what happened on Boxing Day is difficult to grasp. ""Yet Britain's response has shone a light on our nation's character. The last week has shown that the warm caring heart of Britain beats as strong as ever."" He went on to reflect on the values that ""most Britons hold dear"". Looking ahead to the coming general election he pledged to ""turn these beliefs into reality"" and set out the choices he says are facing Britain. ""How much tax do people want to pay? Who will give taxpayers value for money the clean hospitals and good disciplined schools they want? ""Who can be trusted to get a grip on the disorder on our streets and the chaos in our immigration system?""  Mr Blair has failed to tackle these problems he claimed saying he has the ""wrong solution"" to them.  ""The result is big government and higher taxes eroding incentives undermining enterprise and denying people choice. ""Worst of all it is a government that has wasted people's money and failed to tackle the problems families face today."" The Tories he said can cut crime and improve public services without asking people to pay more taxes. ""We can have progress without losing what makes Britain great - its tolerance the respect for the rule of law the ability of everyone to fulfil their potential. ""We simply need to change direction. The election will give Britain the chance to change."" This is the record Mr Blair will have to defend in the coming months he said urging voters to hold him to account.  But Labour spokesman Mr Kemp said: ""It would be more appropriate for this message to come out on 1 April not 1 January."" ""Let us never forget that when Michael Howard was in government Britain suffered mass unemployment 15% interest rates record home repossessions and the introduction of the poll tax. ""With Labour Britain is working. Rather than alluding to false promises Michael Howard should be starting 2005 with an apology to the British people for the misery that the government of which he was a member inflicted upon the country. ";;;
1,British hurdler Sarah Claxton is confident she can win her first major medal at next month's European Indoor Championships in Madrid.  The 25-year-old has already smashed the British record over 60m hurdles twice this season setting a new mark of 7.96 seconds to win the AAAs title. ""I am quite confident"" said Claxton. ""But I take each race as it comes. ""As long as I keep up my training but not do too much I think there is a chance of a medal."" Claxton has won the national 60m hurdles title for the past three years but has struggled to translate her domestic success to the international stage. Now the Scotland-born athlete owns the equal fifth-fastest time in the world this year. And at last week's Birmingham Grand Prix Claxton left European medal favourite Russian Irina Shevchenko trailing in sixth spot.  For the first time Claxton has only been preparing for a campaign over the hurdles - which could explain her leap in form. In previous seasons the 25-year-old also contested the long jump but since moving from Colchester to London she has re-focused her attentions. Claxton will see if her new training regime pays dividends at the European Indoors which take place on 5-6 March. ";;;
1,Sonia O'Sullivan has indicated that she would like to participate in next month's World Cross Country Championships in St Etienne.  Athletics Ireland have hinted that the 35-year-old Cobh runner may be included in the official line-up for the event in France on 19-20 March. Provincial teams were selected after last Saturday's Nationals in Santry and will be officially announced this week. O'Sullivan is at present preparing for the London marathon on 17 April. The participation of O'Sullivan currentily training at her base in Australia would boost the Ireland team who won the bronze three years agio. The first three at Santry last Saturday Jolene Byrne Maria McCambridge and Fionnualla Britton are automatic selections and will most likely form part of the long-course team. O'Sullivan will also take part in the Bupa Great Ireland Run on 9 April in Dublin. ";;;
1,Maurice Greene aims to wipe out the pain of losing his Olympic 100m title in Athens by winning a fourth World Championship crown this summer.  He had to settle for bronze in Greece behind fellow American Justin Gatlin and Francis Obikwelu of Portugal. ""It really hurts to look at that medal. It was my mistake. I lost because of the things I did"" said Greene who races in Birmingham on Friday. ""It's never going to happen again. My goal - I'm going to win the worlds."" Greene crossed the line just 0.02 seconds behind Gatlin who won in 9.87 seconds in one of the closest and fastest sprints of all time. But Greene believes he lost the race and his title in the semi-finals. ""In my semi-final race I should have won the race but I was conserving energy. ""That's when Francis Obikwelu came up and I took third because I didn't know he was there. ""I believe that's what put me in lane seven in the final and while I was in lane seven I couldn't feel anything in the race.  ""I just felt like I was running all alone. ""I believe if I was in the middle of the race I would have been able to react to people that came ahead of me."" Greene was also denied Olympic gold in the 4x100m men's relay when he could not catch Britain's Mark Lewis-Francis on the final leg. The Kansas star is set to go head-to-head with Lewis-Francis again at Friday's Norwich Union Grand Prix. The pair contest the 60m the distance over which Greene currently holds the world record of 6.39 seconds. He then has another indoor meeting in France before resuming training for the outdoor season and the task of recapturing his world title in Helsinki in August. Greene believes Gatlin will again prove the biggest threat to his ambitions in Finland. But he also admits he faces more than one rival for the world crown. ""There's always someone else coming. I think when I was coming up I would say there was me and Ato (Boldon) in the young crowd"" Greene said. ""Now you've got about five or six young guys coming up at the same time."" ";;;
1,The IAAF - athletics' world governing body - has met anti-doping officials coaches and athletes to co-ordinate the fight against drugs in sport.  Two task forces have been set up to examine doping and nutrition issues. It was also agreed that a programme to ""de-mystify"" the issue to athletes the public and the media was a priority. ""Nothing was decided to change things - it was more to have a forum of the stakeholders allowing them to express themselves"" said an IAAF spokesman. ""Getting everyone together gave us a lot of food for thought."" About 60 people attended Sunday's meeting in Monaco including IAAF chief Lamine Diack and Namibian athlete Frankie Fredericks now a member of the Athletes' Commission. ""I am very happy to see you all members of the athletics family respond positively to the IAAF call to sit together and discuss what more we can do in the fight against doping"" said Diack. ""We are the leading Federation in this field and it is our duty to keep our sport clean."" The two task forces will report back to the IAAF Council at its April meeting in Qatar. ";;;
1,Ethiopia's Tirunesh Dibaba set a new world record in winning the women's 5000m at the Boston Indoor Games.  Dibaba won in 14 minutes 32.93 seconds to erase the previous world indoor mark of 14:39.29 set by another Ethiopian Berhane Adera in Stuttgart last year. But compatriot Kenenisa Bekele's record hopes were dashed when he miscounted his laps in the men's 3000m and staged his sprint finish a lap too soon. Ireland's Alistair Cragg won in 7:39.89 as Bekele battled to second in 7:41.42. ""I didn't want to sit back and get out-kicked"" said Cragg. ""So I kept on the pace. The plan was to go with 500m to go no matter what but when Bekele made the mistake that was it. The race was mine."" Sweden's Carolina Kluft the Olympic heptathlon champion and Slovenia's Jolanda Ceplak had winning performances too. Kluft took the long jump at 6.63m while Ceplak easily won the women's 800m in 2:01.52. ";;;
1,Pole vaulter Yelena Isinbayeva broke her own indoor world record by clearing 4.89 metres in Lievin on Saturday.  It was the Russian's 12th world record of her career and came just a few days after she cleared 4.88m at the Norwich Union Grand Prix in Birmingham. The Olympic champion went on to attempt 5.05m at the meeting on France but failed to clear that height. In the men's 60m former Olympic 100m champion Maurice Greene could only finish second to Leonard Scott. It was Greene's second consecutive defeat at the hands of his fellow American who also won in Birmingham last week. ""I ran my race perfectly"" said Scott who won in 6.46secs his best time indoors. ""I am happy even if I know that Maurice is a long way from being at his peak at the start of the season."" ";;;
