0,An ex-Russian intelligence officer who risked his life spying for MI6 is entering the seventh week of a hunger strike near 10 Downing Street.  Viktor Makarov 50 claims he has been betrayed by the British authorities who promised he would live like an ""average British citizen"". But despite a £65000 settlement four years ago he says he has been denied defector status and a decent pension. Other ex-Russian spies have been given civil service pensions. ""Hunger strike is a weapon of last resort. It can work only with determination and of course the realisation of the righteousness of your case - without that it will not work"" Mr Makarov told the BBC's Newsnight programme. ""Since I came to this country two batches of promises have been made and broken one after the other.""  Oleg Gordievsky a senior KGB officer who became a secret agent for the British said he was ""very happy"" with the way the government have treated him since him since he defected in 1985. Commenting on Mr Makarov's case he said: ""The British state is not a fat cow - it is impossible to come here and demand give me more money every week."" But Mr Makarov's case has been backed by David Kahn - a former Yale historian and a leading expert on code-breaking who has confirmed his information was valuable to the Western allies. ""I believe the government of the United Kingdom which in that respect was probably the same as most other power authorities - took the information that Victor Makarov had wrung him dry and left him to hang out in the cold"" Mr Kahn said.  Mr Makarov joined the KGB in 1970s Russia as an idealistic 20 year-old. One of his fellow pupils at intelligence school was Vladimir Putin. At KGB headquarters in Moscow he was posted to the secret 16th directorate - which decoded intercepted diplomatic traffic from the West. By the 1980s he had risen to the rank of senior lieutenant - and was privy to the thoughts of Western powers. But he had became deeply disenchanted with the Soviet regime - fuelled by its repression both at home and in Poland.  Through his English teacher he made an approach to M16 - and then began passing secrets to the British intelligence service. He spied for MI6 for two years before being betrayed by a friend and sent to Perm 35 - a Soviet hard labour camp in the Artic circle. Within a week of his release in 1992 he made contact with the British authorities he'd been spying for who arranged a meeting between him and an MI6 agent in Latvia. He was given a false passport and he says promised that he would be given the chance to live like an average UK citizen. But after arriving in London 13 years ago he feels this promise has not been fulfilled. After long periods of living in bedsits with deteriorating health four years ago he took legal action against the government - and settled for £65000 to buy a small house. But he says he will remain on hunger strike until he receives a decent pension and the right to work something he feels he has been denied because the authorities do not trust him. Government sources told the BBC they had reached a final settlement with the former spy which he has been able to appeal to security and intelligence tribunals. ";;;
0,The Liberal Democrats are promising to raise the stamp duty threshold if they win the general election in a bid to court first-time house buyers.  Vince Cable the party's Treasury spokesman said raising the threshold to £150000 would prevent over 400000 home-buyers from paying the tax. He said first-time buyers were being ""squeezed out"" of the housing market. The Labour party said the Liberal Democrats needed to explain how they would pay for the plan. The plan forms part of a wider Lib Dems policy to encourage first time buyers and those on lower incomes into the market.  Under the proposals the average saving for a new buyer would be more than £1000 according to Mr Cable. ""First time buyers are being squeezed out of the housing market not only by higher house prices but also by being swept into the stamp duty net"" he said. ""By failing to uprate the stamp duty threshold Gordon Brown has hit first time buyers and those on low incomes the hardest. ""By pledging to increase the threshold to £150000 the Liberal Democrats will make it possible for many first time buyers to buy a property without facing this tax."" Paul Boateng MP Labour's Chief Secretary to the Treasury said: ""The Lib Dems' sums don't add up. ""They can have no credibility until they can say how they would fund their ever growing list of tax and spending commitments."" Mr Cable will publish his ""Alternative Budget"" on Monday. ";;;
0,Teachers could get more powers to remove unruly pupils from classes under a ""zero tolerance"" drive Education Secretary Ruth Kelly has suggested.  Ms Kelly told the BBC progress had been made against severely disruptive children but parents were still worried about lower level problems. The minister also confirmed she received ""spiritual support"" from the Catholic movement Opus Dei. But she denied her faith meant she would refuse key government jobs.  The Conservatives have made school discipline one of their five priority areas in the run-up to the next general election. Ms Kelly is expected to announce her plans on the issue in the next fortnight. She told BBC One's Breakfast with Frost: ""It is really important to support head teachers and teachers in tackling disruption in the classroom. ""We have made huge progress on the really difficult cases the pupils who have severely disruptive behaviour.  ""But quite rightly what teachers are concerned about and what parents are concerned about is that this lower level disruption that goes on in the classroom now is tackled. ""I would like to see the teacher being able to remove disruptive children from the classroom completely and have either alternative provision within the school or indeed off the school and may be working together with other schools in a particular area to provide that provision."" It is thought the plans may distinguish between excluding pupils from schools and taking them out of mainstream classes. Head teachers can currently exclude pupils who commit or threaten violence in school who sexually abuse pupils or other people who sell illegal drugs or who have persistent and malicious disruptive behaviour. Ms Kelly entered the Cabinet last month in the reshuffle forced by the resignation of the then Home Secretary David Blunkett. Her links to Opus Dei which means ""Work of God"" in Latin have provoked controversy.  Critics say the organisation which adheres strictly to Catholic teachings is secretive and elitist but its members reject such claims. Asked if she was a member of the group Ms Kelly said: ""I do have spiritual support from Opus Dei and that is right. ""But those are private spiritual matters and I'm sure you'll respect that politicians are entitled to a private life."" She categorically denied reports that her beliefs on issues such as contraception would make her refuse to serve as a health or international development minister. Her collective responsibility as a Cabinet minister meant she also took responsibility for policies in those areas she argued.  The government has yet to issue its official response to the Tomlinson review which recommended absorbing existing exam qualifications into a diploma. Ms Kelly said reforms should build on GCSEs and A-levels. Her comments did not impress Tory shadow education secretary Tim Collins. ""Ruth Kelly wants to ditch the Tomlinson report on exam structures but has absolutely no idea what to put in its place"" he said. ""She also talks of improving discipline but cannot make her mind up how. This is an all talk agenda that lets down children teachers and parents."" ";;;
0,Citizenship ceremonies could be introduced for people celebrating their 18th birthday Charles Clarke has said.  The idea will be tried as part of an overhaul of the way government approaches ""inclusive citizenship"" particularly for ethnic minorities. A pilot scheme based on ceremonies in Australia will start in October. Mr Clarke said it would be a way of recognising young people reaching their voting age when they also gain greater independence from parents. Britain's young black and Asian people are to be encouraged to learn about the nation's heritage as part of the government's new race strategy which will also target specific issues within different ethnic minority groups. Officials say the home secretary wants young people to feel they belong and to understand their ""other cultural identities"" alongside being British. The launch follows a row about the role of faith schools in Britain. On Monday school inspection chief David Bell accused some Islamic schools of failing to teach pupils about their obligations to British society.  The Muslim Council of Britain said Ofsted boss Mr Bell's comments were ""highly irresponsible"". The Home Office started work on its Community Cohesion and Race Equality Strategy last year and the outcome launched on Wednesday is called 'Improving Opportunity Strengthening Society'. It is aimed at tackling racism exclusion segregation and the rise in political and religious extremism. ""It represents a move away from the one-size-fits-all approach to focus on specifics within cultural groups"" said a Home Office spokesman. ""It is not right to say that if you are from a black or ethnic minority group you must be disadvantaged."" The spokesman highlighted specific issues that affect particular communities - for example people of south Asian origin tend to suffer from a high incidence of heart disease.  ""It is about drilling down and focusing on these sorts of problems"" the spokesman added. Launching the initiative Mr Clarke said enormous progress had been made on race issues in recent years. He added: ""But while many members of black and minority ethnic communities are thriving some may still find it harder to succeed in employment or gain access to healthcare education or housing. ""This strategy sets out the government's commitment to doing more to identify and respond to the specific needs of minorities in our society."" Some 8% of the UK population described themselves as coming from a non-white ethnic minority in the 2001 Census.  The Downing Street Strategy Unit in 2003 said people from Indian and Chinese backgrounds were doing well on average often outperforming white people in education and earnings. But those of Pakistani Bangladeshi and black Caribbean origin were significantly more likely to be unemployed and earn less than whites it said. The Home Office wants more initiatives which try to promote a sense of belonging by encouraging young people to take part in voluntary work. The programmes are designed to support the citizenship lessons already taking place in schools. ";;;
0,The first children's commissioner for England has been appointed.  Great Ormond Street Hospital professor of child health Al Aynsley-Green was chosen by the government and will start the £100000-a-year job immediately. He will oversee a £2.5m annual budget and have the power to look into ""any matter relating to the interests and well-being of children"". Prof Aynsley-Green has also been the national clinical director for children in the Department of Health. He promised to make sure that children's opinions ""count"".  ""I will be drawing on my experience of working with children and young people to help ensure that those with the power to improve children's lives do live up to their responsibilities. ""I want all children and young people to know that they can approach me to discuss any matter that affects them knowing that I will value their opinion."" Education Secretary Ruth Kelly said Prof Aynsley-Green would ""strengthen the voice of children and young people"". Prof Aynsley-Green was a lecturer at Oxford University trained at Guy's Hospital Medical School University of London"; Oriel College Oxford;" and in Switzerland. He is described as ""a proud grandfather"" of four. Scotland Wales and Northern Ireland already have children's commissioners. ";
0,The EU embargo on arms exports to China is likely to be lifted in the next six months despite US objections UK Foreign Secretary Jack Straw has said.  The 15-year-old ban was imposed in the aftermath of China's crackdown on protesters in Tiananmen Square. Mr Straw told a Commons select committee human rights concerns over China remained. But he said it was wrong to put China under the same embargo as countries such as Zimbabwe and Burma.  In December the EU pledged to work towards lifting the ban but said it was not ready to do so yet. The EU's move was welcomed at the time by Beijing which described the embargo as a ""product of the Cold War"". German Chancellor Gerhard Schroeder and French President Jacques Chirac have repeatedly called for the embargo to be lifted. Britain has been more cautious on the issue but on Wednesday Mr Straw said he also wanted it to end. ""I have long understood China's argument that to lump them in with say Burma and Zimbabwe is not appropriate and I don't think it is"" he told the joint committee on Strategic Export Controls. He said ""it is more likely than not"" that the ban would be lifted before Britain takes over the presidency of the EU from Luxembourg in July. But he said an EU code of conduct would prevent an increase in the number of arms being exported to the country. ""If it is lifted we will end up with as effective arms controls in relation to China as we have now.""  Mr Straw said the US government was suspicious of ""the motives of some other countries within the EU"" in wanting the ban lifted. But he said many of Washington's objections were based on a ""lack of information and understanding"" of how export control guidelines worked in EU countries. And ""intense discussions"" were taking place with US officials to convince them it was the right thing to do. Washington is thought to fear it would lead to a buying spree for arms that could be used by China to threaten its diplomatic rival Taiwan. US officials say they are not satisfied the mechanisms in the EU code of conduct are robust enough to prevent abuses. US Undersecretary of State John Bolton is meeting British officials this week to press the case for keeping the embargo. ";;;
0,A cap on donations to political parties should not be introduced yet the elections watchdog has said.  Fears that big donors can buy political favours have sparked calls for a limit. In a new report the Electoral Commission says it is worth debating a £10000 cap for the future but now is not the right time to introduce it. It also says there should be more state funding for political parties and candidates should be able to spend more on election campaigning.  There were almost £68m in reported donations to political parties in 2001 2002 and 2003 with nearly £12m of them from individual gifts worth more than £1m. The rules have already been changed so the public can see who gives how much to the parties but the report says there are still public suspicions. The commission says capping donations would mean taxpayers giving parties more cash - something which would first have to be acceptable to the public and shown to work. ""While we are not in principle opposed to the introduction of a donation cap we do not believe that such a major departure from the existing system now would be sensible"" says its report. If there was to be a cap it should be £10000 - a small enough amount to make a difference but which would have banned £56m in donations between 2001 and 2003.  Even without changes the commission does urge political parties to seek out more small-scale donations and suggests there should be income tax relief for gifts under £200. It also suggests increasing state funding for parties to £3m so help can be extended to all parties with at least two members in the House of Commons European Parliament Scottish Parliament Welsh Assembly or Northern Ireland Assembly. And it suggests new ways of boosting election campaigning seen as a way of improving voter turnout. All local election candidates should be entitled to a free mailshot for campaign leaflets says the watchdog. And there should be a shift in the amount of money allowed to be spent at elections from a national level to a local level to help politicians engage better with voters.  The report suggests doubling the money which can be spent by candidates while cutting national spending limits from £20m to £15m. The commission also says the spending limits for general elections should cover the four months before the poll - as happens with other elections. Electoral Commission chairman Sam Younger said: ""There is no doubt that political parties have a vital role to play in maintaining the health of our democracy and for this they need to be adequately resourced. ""Our research has shown that people want to be more informed about party politics and that they want politicians to be more visible and accessible. ""The public are reluctant for the state to fund parties but at the same time are unhappy with large private donations."" He called for a wider public debate on party funding to find the consensus needed for radical changes to the current system. ";;;
0,Billions of pounds spent on conflict in Iraq and in the Middle East should have been used to reduce poverty Cardinal Cormac Murphy-O'Connor has said.  The head of the Catholic Church in England and Wales made the comments on BBC Radio 4 and will re-iterate his stance in his Christmas Midnight Mass. The cardinal used a Christmas message to denounce the war in Iraq as a ""terrible"" waste of money. He and the Archbishop of Canterbury have both spoken out about the war.  Speaking on BBC Radio 4's Thought for the Day slot he criticised the fact that ""billions"" have been spent on war instead of being used to bring people ""out of dire poverty and malnourishment and disease"". The cardinal said 2005 should be the year for campaigning to ""make history poverty"". He added: ""If the governments of the rich countries were as ready to devote to peace the resources they are willing to commit to war that would be to see with new eyes and speak with a new voice and perhaps then others would listen to us with new ears."" The cardinal will touch on this theme again on Friday night when he will tell the congregation of 2000 at Westminster Cathedral that peace is ""worth always striving for"".  ""How is it that peace has not arrived?"" the cardinal will ask. ""How is it that there is war in Iraq violence in the Holy Land and the horror of pain and death amongst the poor and deprived who suffer from injustice and thus do not find peace?"" ""How can one wish a happy Christmas for our fellow Christians in Iraq or in the Holy Land or those who suffer in Africa unless you and I in whatever way is open to us say and do what makes for peace?"" Both the Cardinal and Archbishop of Canterbury Dr Rowan Williams appealed for the weapons inspectors to be given more time in Iraq before the war started. Dr Williams has since criticised the government over its case for war saying the failure to find weapons of mass destruction had damaged faith in the political system.  On Friday the Cardinal will ask the congregation to search for peace. ""It is possible it is real it is worth always striving for because of the promise of Our Saviour"" he will say. ""I also wish you peace in your homes because peace in your home is the beginning of peace in the homes of the community. "" A spokesman said Downing Street had no comment to make. But Prime Minister Tony Blair has said he will put Africa at the top of the agenda when Britain chairs the G8 summit next year. ";;;
0,Hundreds of ballot papers for the regional assembly referendum in the North East have ""disappeared"".  Royal Mail says it is investigating the situation which has meant about 300 homes in County Durham are not receiving voting packs. Officials at Darlington Council are now in a race against time to try and rectify the situation. The all-postal votes of about two million electors are due to be handed in by 4 November. A spokesman for Darlington Council said: ""We have sent out the ballot papers the problem is with Royal Mail. ""Somewhere along the line something has gone wrong and these ballot papers have not been delivered. ""The Royal Mail is investigating to see if they can find out what the problem is.""  A spokeswoman for Royal Mail said: ""We are investigating a problem with the delivery route in the Mowden area of Darlington. ""This is affecting several hundred properties which have failed to receive ballot papers. ""We are working closely with the council and will do all we can to help rectify the problem. ""No-one will not receive their ballot paper as special hand deliveries will take place where necessary. ""We are unaware of any other problems of this kind to do with the regional assembly vote.""  The Darlington Council spokesman added: ""Initially we had complaints from a couple of residents in Mowden to say they thought they should have had their ballot papers by now. ""We then made further investigations and it became clear this was a bigger issue."" A spokeswoman for the Electoral Commission told BBC News Online that letters were being sent out to those homes affected. She said the commission was satisfied that measures had been put in place to ensure all voters received ballot papers in time. So far a total of 569072 ballot envelopes have been scanned by bar code at counting offices across the North East. ";;;
0,Issues that Muslims should be considering before voting in the next general election are to be debated by UK community representatives.  The event is being held by the Muslim Association of Britain (MAB) which believes Muslim voters could influence the result in up to 50 constituencies. Last year MAB which opposed the war in Iraq urged Muslims not to vote for Labour in the European elections. But a spokesman stressed the meeting was ""not necessarily anti-Labour"". ""This meeting is not anti-party in particular it's anti-policy it's on the issues we are going to ask Muslims to vote on"" MAB spokesman Dr Azzam Tamimi said of Tuesday's event.  ""There are issues of concern to Muslims and Muslims generally agree on them but have not in the past been aware of how a vote can serve these issues."" Dr Tamimi said the main issues Muslims should consider were what he referred to as the war on Iraq the Palestinian situation the erosion of civil liberties for Muslims in the UK and economic social and education problems.  Approximately 1.1m of the UK's 1.6m Muslims are of voting age. Previous election research has shown the overwhelming majority have traditionally voted Labour but more recent studies have suggested Labour support has been falling away significantly among some Muslim voters.  Anger over the war in Iraq has appeared to be the main reason with many saying it was ""unjustified"". Representatives from a number of Muslim organisations will attend Tuesday's event. Among them will be the Muslim Council of Britain (MCB). The chairman of the MCB's public affairs committee Sher Khan said the war in Iraq would be a ""significant factor"" affecting Muslims' voting intentions. ""I think it's going to be quite significant because of the number of seats in which they could have an impact"" Mr Khan said.  However Professor John Curtice of the University of Strathclyde is sceptical about how much difference tactical voting by Muslims could make. ""For the most part the Labour constituencies where there's a large Muslim community are relatively safe but there are one or two that are not quite so safe"" Professor Curtice said.  The constituencies where Labour was most at risk from a Muslim tactical vote were Bethnal Green in east London and Rochdale in Lancashire he added. In Bethnal Green former Labour MP George Galloway who founded the anti-war party Respect is standing against sitting MP Oona King who had a 10000-vote majority in 2001. In Rochdale the Liberal Democrats - the mainstream party a 2004 ICM survey showed was benefiting most from Muslim disaffection with Labour - secured second place in the 2001 election securing just under 6000 votes fewer than Labour's Lorna Fitzsimons. But Professor Curtice said the Muslim anti-war vote could be split between the Liberal Democrats and Respect meaning neither would benefit much at the ballot box. ""Ironically the Tories might be the beneficiaries if Labour does lose seats which is generally the case"" he said. But Dr Tamimi said MAB's intention was not to ""empower"" the Tories. ""We know the next government will be Labour but we are aiming to send a message that it will make a difference if the Muslims use their vote properly. ""If the next Labour government has a reduced majority that's a great achievement because having a very big majority has been very harmful for politics in this country"" Dr Tamimi said. ";;;
